<?xml version="1.0"?>
<xs:schema xmlns:xs="http://www.w3.org/2001/XMLSchema" elementFormDefault="qualified">
	<xs:element name="main">
		<xs:complexType>
			<xs:sequence>
				<xs:element name="frame" minOccurs="3" maxOccurs="3">
					<xs:complexType>
							<xs:sequence>
								<xs:element name="titolo">
									<xs:simpleType>
										<xs:restriction base="xs:string">
											<xs:minLength value="1"/>
											<xs:maxLength value="200"/>
										</xs:restriction>
									</xs:simpleType>
								</xs:element>
								<xs:element name="corpo">
									<xs:simpleType>
										<xs:restriction base="xs:string">
											<xs:minLength value="1"/>
											<xs:maxLength value="20000"/>
										</xs:restriction>
									</xs:simpleType>
								</xs:element>
							</xs:sequence>
						<xs:attribute name="id" type="xs:string" />
					</xs:complexType>
				</xs:element>
			</xs:sequence>
		</xs:complexType>
	</xs:element>
</xs:schema>